{
  "schema_version": "sl0021-sampled-candidates-v1",
  "generated_at": "2026-08-24T15:29:04.154534+00:00",
  "selection": {
    "cap_per_route": 75,
    "cap_global": 200,
    "per_route_pre_global_cap": {
      "R1": [
        "Q232393",
        "Q1638809",
        "Q1662367",
        "Q1913784",
        "Q2816929",
        "Q3321276",
        "Q3334777",
        "Q4564080",
        "Q5470264",
        "Q10397376",
        "Q10404347",
        "Q10405576",
        "Q10405577",
        "Q10417274",
        "Q10443255",
        "Q10478080",
        "Q10518647",
        "Q10552991",
        "Q10555133",
        "Q10555135",
        "Q10561683",
        "Q10578706",
        "Q10578709",
        "Q10578710",
        "Q10578711",
        "Q10578712",
        "Q10586324",
        "Q10602060",
        "Q10608006",
        "Q10609560",
        "Q10609561",
        "Q10614462",
        "Q10648230",
        "Q10655904",
        "Q10681251",
        "Q10681424",
        "Q10693607",
        "Q10701406",
        "Q10704615",
        "Q10706438",
        "Q10706946",
        "Q10711989",
        "Q10716022",
        "Q18448502",
        "Q18449521",
        "Q18452269",
        "Q18454564",
        "Q31888504",
        "Q56377229",
        "Q105111126",
        "Q106541126",
        "Q133733814",
        "Q137537140"
      ],
      "R2": [],
      "R3": [
        "Q19060217",
        "Q117468602",
        "Q117569839",
        "Q121872268"
      ]
    },
    "selected_qids": [
      "Q232393",
      "Q1638809",
      "Q1662367",
      "Q1913784",
      "Q2816929",
      "Q3321276",
      "Q3334777",
      "Q4564080",
      "Q5470264",
      "Q10397376",
      "Q10404347",
      "Q10405576",
      "Q10405577",
      "Q10417274",
      "Q10443255",
      "Q10478080",
      "Q10518647",
      "Q10552991",
      "Q10555133",
      "Q10555135",
      "Q10561683",
      "Q10578706",
      "Q10578709",
      "Q10578710",
      "Q10578711",
      "Q10578712",
      "Q10586324",
      "Q10602060",
      "Q10608006",
      "Q10609560",
      "Q10609561",
      "Q10614462",
      "Q10648230",
      "Q10655904",
      "Q10681251",
      "Q10681424",
      "Q10693607",
      "Q10701406",
      "Q10704615",
      "Q10706438",
      "Q10706946",
      "Q10711989",
      "Q10716022",
      "Q18448502",
      "Q18449521",
      "Q18452269",
      "Q18454564",
      "Q19060217",
      "Q31888504",
      "Q56377229",
      "Q105111126",
      "Q106541126",
      "Q117468602",
      "Q117569839",
      "Q121872268",
      "Q133733814",
      "Q137537140"
    ],
    "selected_count": 57
  },
  "accepted_universe_reference": {
    "sl0017_sha256": "076b0d64441973c4d5b71cf467cd9cdbf46242babb9cb44f788c97a0f33e5845",
    "sl0018_sha256": "41ef238c217e31cfbe03329e226a1a3dfff849061df93b8f2523a1e72493821f",
    "accepted_auto_admit_count": 1770
  },
  "candidates": [
    {
      "qid": "Q232393",
      "route_membership": [
        "R1"
      ],
      "label": "Zweier-Canadier",
      "aliases": [],
      "description_en": "German term: a boat class in Canoeing",
      "p31_qids": [
        "Q893182"
      ],
      "p279_qids": [
        "Q1075310"
      ],
      "p176_qids": [],
      "p287_qids": [],
      "identity_signal_category": "no_exact_identity_signal",
      "identity_signal_owner_qids": []
    },
    {
      "qid": "Q1638809",
      "route_membership": [
        "R1"
      ],
      "label": "Libera",
      "aliases": [],
      "description_en": null,
      "p31_qids": [
        "Q893182"
      ],
      "p279_qids": [
        "Q1075310"
      ],
      "p176_qids": [],
      "p287_qids": [],
      "identity_signal_category": "no_exact_identity_signal",
      "identity_signal_owner_qids": []
    },
    {
      "qid": "Q1662367",
      "route_membership": [
        "R1"
      ],
      "label": "Inferno 29",
      "aliases": [],
      "description_en": null,
      "p31_qids": [
        "Q1307792"
      ],
      "p279_qids": [
        "Q474161",
        "Q1075310"
      ],
      "p176_qids": [],
      "p287_qids": [],
      "identity_signal_category": "no_exact_identity_signal",
      "identity_signal_owner_qids": []
    },
    {
      "qid": "Q1913784",
      "route_membership": [
        "R1"
      ],
      "label": "Maxi 68",
      "aliases": [],
      "description_en": "ship type",
      "p31_qids": [
        "Q1307792"
      ],
      "p279_qids": [
        "Q1075310"
      ],
      "p176_qids": [],
      "p287_qids": [],
      "identity_signal_category": "no_exact_identity_signal",
      "identity_signal_owner_qids": []
    },
    {
      "qid": "Q2816929",
      "route_membership": [
        "R1"
      ],
      "label": "49er FX",
      "aliases": [],
      "description_en": "Olympic sailing class",
      "p31_qids": [
        "Q893182"
      ],
      "p279_qids": [
        "Q1075310"
      ],
      "p176_qids": [],
      "p287_qids": [
        "Q1711955"
      ],
      "identity_signal_category": "no_exact_identity_signal",
      "identity_signal_owner_qids": []
    },
    {
      "qid": "Q3321276",
      "route_membership": [
        "R1"
      ],
      "label": "Chatou one-design dinghy",
      "aliases": [],
      "description_en": null,
      "p31_qids": [
        "Q97225127"
      ],
      "p279_qids": [
        "Q239617"
      ],
      "p176_qids": [],
      "p287_qids": [],
      "identity_signal_category": "no_exact_identity_signal",
      "identity_signal_owner_qids": []
    },
    {
      "qid": "Q3334777",
      "route_membership": [
        "R1"
      ],
      "label": "Nacra 17",
      "aliases": [],
      "description_en": "Olympic sailing class",
      "p31_qids": [
        "Q893182"
      ],
      "p279_qids": [
        "Q2941651"
      ],
      "p176_qids": [
        "Q48995769"
      ],
      "p287_qids": [
        "Q106436209"
      ],
      "identity_signal_category": "no_exact_identity_signal",
      "identity_signal_owner_qids": []
    },
    {
      "qid": "Q4564080",
      "route_membership": [
        "R1"
      ],
      "label": "OE 36",
      "aliases": [],
      "description_en": "ship type",
      "p31_qids": [
        "Q1307792"
      ],
      "p279_qids": [
        "Q1075310"
      ],
      "p176_qids": [],
      "p287_qids": [
        "Q2020958"
      ],
      "identity_signal_category": "no_exact_identity_signal",
      "identity_signal_owner_qids": []
    },
    {
      "qid": "Q5470264",
      "route_membership": [
        "R1"
      ],
      "label": "Formula 16",
      "aliases": [],
      "description_en": "5 metre catamaran",
      "p31_qids": [
        "Q3511280"
      ],
      "p279_qids": [
        "Q2265995"
      ],
      "p176_qids": [],
      "p287_qids": [],
      "identity_signal_category": "no_exact_identity_signal",
      "identity_signal_owner_qids": []
    },
    {
      "qid": "Q10397376",
      "route_membership": [
        "R1"
      ],
      "label": "707",
      "aliases": [],
      "description_en": "boat model",
      "p31_qids": [
        "Q1307792"
      ],
      "p279_qids": [
        "Q1075310"
      ],
      "p176_qids": [],
      "p287_qids": [],
      "identity_signal_category": "no_exact_identity_signal",
      "identity_signal_owner_qids": []
    },
    {
      "qid": "Q10404347",
      "route_membership": [
        "R1"
      ],
      "label": "Albin Delta",
      "aliases": [],
      "description_en": null,
      "p31_qids": [
        "Q1307792"
      ],
      "p279_qids": [
        "Q1075310"
      ],
      "p176_qids": [],
      "p287_qids": [
        "Q6016960"
      ],
      "identity_signal_category": "no_exact_identity_signal",
      "identity_signal_owner_qids": []
    },
    {
      "qid": "Q10405576",
      "route_membership": [
        "R1"
      ],
      "label": null,
      "aliases": [],
      "description_en": null,
      "p31_qids": [
        "Q1307792"
      ],
      "p279_qids": [
        "Q1075310"
      ],
      "p176_qids": [],
      "p287_qids": [],
      "identity_signal_category": "no_exact_identity_signal",
      "identity_signal_owner_qids": []
    },
    {
      "qid": "Q10405577",
      "route_membership": [
        "R1"
      ],
      "label": null,
      "aliases": [],
      "description_en": null,
      "p31_qids": [
        "Q1307792"
      ],
      "p279_qids": [
        "Q1075310"
      ],
      "p176_qids": [],
      "p287_qids": [],
      "identity_signal_category": "no_exact_identity_signal",
      "identity_signal_owner_qids": []
    },
    {
      "qid": "Q10417274",
      "route_membership": [
        "R1"
      ],
      "label": "Arcona 40 DS",
      "aliases": [],
      "description_en": "Swedish sailboat type",
      "p31_qids": [
        "Q1307792"
      ],
      "p279_qids": [
        "Q1075310"
      ],
      "p176_qids": [],
      "p287_qids": [],
      "identity_signal_category": "no_exact_identity_signal",
      "identity_signal_owner_qids": []
    },
    {
      "qid": "Q10443255",
      "route_membership": [
        "R1"
      ],
      "label": "Carrera Helmsman",
      "aliases": [],
      "description_en": null,
      "p31_qids": [
        "Q1307792"
      ],
      "p279_qids": [
        "Q1075310"
      ],
      "p176_qids": [],
      "p287_qids": [
        "Q6201893"
      ],
      "identity_signal_category": "no_exact_identity_signal",
      "identity_signal_owner_qids": []
    },
    {
      "qid": "Q10478080",
      "route_membership": [
        "R1"
      ],
      "label": null,
      "aliases": [],
      "description_en": null,
      "p31_qids": [
        "Q1307792"
      ],
      "p279_qids": [
        "Q1075310"
      ],
      "p176_qids": [],
      "p287_qids": [],
      "identity_signal_category": "no_exact_identity_signal",
      "identity_signal_owner_qids": []
    },
    {
      "qid": "Q10518647",
      "route_membership": [
        "R1"
      ],
      "label": null,
      "aliases": [],
      "description_en": null,
      "p31_qids": [
        "Q1307792"
      ],
      "p279_qids": [